{
  "$schema": "http://json-schema.org/draft-07/schema#",
  "title": "Full Plugin Configuration",
  "type": "object",
  "required": ["core"],
  "additionalProperties": false,
  "properties": {
    "$schema": {
      "type": "string",
      "description": "URL to the JSON schema for this configuration file."
    },
    "core": { "$ref": "./templates/core.schema.json" },
    "npm": { "$ref": "./templates/npm.schema.json" },
    "php": { "$ref": "./templates/php.schema.json" },
    "wp": { "$ref": "./templates/wp-core.schema.json" },
    "block": { "$ref": "./templates/block/schema.json" }
  }
}
